PS C:\Users\lando\Desktop\School\2026 Spring\CECS 327\BiteOfDistributedCommunication\TCP> docker exec -it tcp-anycast_server-1 tcpdump -i eth0 tcp port 5000 -nn
tcpdump: verbose output suppressed, use -v[v]... for full protocol decode
listening on eth0, link-type EN10MB (Ethernet), snapshot length 262144 bytes
21:59:52.213477 IP 172.18.0.5.39738 > 172.18.0.2.5000: Flags [S], seq 71365062, win 64240, options [mss 1460,sackOK,TS val 3275460753 ecr 0,nop,wscale 7], length 0
21:59:52.213527 IP 172.18.0.2.5000 > 172.18.0.5.39738: Flags [S.], seq 1959587166, ack 71365063, win 65160, options [mss 1460,sackOK,TS val 1368176491 ecr 3275460753,nop,wscale 7], length 0
21:59:52.213595 IP 172.18.0.5.39738 > 172.18.0.2.5000: Flags [.], ack 1, win 502, options [nop,nop,TS val 3275460753 ecr 1368176491], length 0
21:59:52.214195 IP 172.18.0.2.5000 > 172.18.0.5.39738: Flags [P.], seq 1:26, ack 1, win 510, options [nop,nop,TS val 1368176491 ecr 3275460753], length 25
21:59:52.214349 IP 172.18.0.5.39738 > 172.18.0.2.5000: Flags [.], ack 26, win 502, options [nop,nop,TS val 3275460753 ecr 1368176491], length 0
21:59:52.214406 IP 172.18.0.2.5000 > 172.18.0.5.39738: Flags [F.], seq 26, ack 1, win 510, options [nop,nop,TS val 1368176492 ecr 3275460753], length 0
21:59:52.214555 IP 172.18.0.5.39738 > 172.18.0.2.5000: Flags [F.], seq 1, ack 27, win 502, options [nop,nop,TS val 3275460754 ecr 1368176492], length 0
21:59:52.214888 IP 172.18.0.2.5000 > 172.18.0.5.39738: Flags [.], ack 2, win 510, options [nop,nop,TS val 1368176492 ecr 3275460754], length 0
22:00:02.227823 IP 172.18.0.5.54084 > 172.18.0.2.5000: Flags [S], seq 485224943, win 64240, options [mss 1460,sackOK,TS val 3275470767 ecr 0,nop,wscale 7], length 0
22:00:02.227854 IP 172.18.0.2.5000 > 172.18.0.5.54084: Flags [S.], seq 1250605012, ack 485224944, win 65160, options [mss 1460,sackOK,TS val 1368186505 ecr 3275470767,nop,wscale 7], length 0
22:00:02.227888 IP 172.18.0.5.54084 > 172.18.0.2.5000: Flags [.], ack 1, win 502, options [nop,nop,TS val 3275470767 ecr 1368186505], length 0
22:00:02.228149 IP 172.18.0.2.5000 > 172.18.0.5.54084: Flags [P.], seq 1:26, ack 1, win 510, options [nop,nop,TS val 1368186505 ecr 3275470767], length 25
22:00:02.228217 IP 172.18.0.5.54084 > 172.18.0.2.5000: Flags [.], ack 26, win 502, options [nop,nop,TS val 3275470767 ecr 1368186505], length 0
22:00:02.228244 IP 172.18.0.2.5000 > 172.18.0.5.54084: Flags [F.], seq 26, ack 1, win 510, options [nop,nop,TS val 1368186505 ecr 3275470767], length 0
22:00:02.228405 IP 172.18.0.5.54084 > 172.18.0.2.5000: Flags [F.], seq 1, ack 27, win 502, options [nop,nop,TS val 3275470768 ecr 1368186505], length 0
22:00:02.228421 IP 172.18.0.2.5000 > 172.18.0.5.54084: Flags [.], ack 2, win 510, options [nop,nop,TS val 1368186506 ecr 3275470768], length 0
22:00:06.234044 IP 172.18.0.5.48072 > 172.18.0.2.5000: Flags [S], seq 4178551650, win 64240, options [mss 1460,sackOK,TS val 3275474773 ecr 0,nop,wscale 7], length 0
22:00:06.234087 IP 172.18.0.2.5000 > 172.18.0.5.48072: Flags [S.], seq 1111462108, ack 4178551651, win 65160, options [mss 1460,sackOK,TS val 1368190511 ecr 3275474773,nop,wscale 7], length 0
22:00:06.234143 IP 172.18.0.5.48072 > 172.18.0.2.5000: Flags [.], ack 1, win 502, options [nop,nop,TS val 3275474773 ecr 1368190511], length 0
22:00:06.234507 IP 172.18.0.2.5000 > 172.18.0.5.48072: Flags [P.], seq 1:26, ack 1, win 510, options [nop,nop,TS val 1368190512 ecr 3275474773], length 25
22:00:06.234594 IP 172.18.0.5.48072 > 172.18.0.2.5000: Flags [.], ack 26, win 502, options [nop,nop,TS val 3275474774 ecr 1368190512], length 0
22:00:06.234634 IP 172.18.0.2.5000 > 172.18.0.5.48072: Flags [F.], seq 26, ack 1, win 510, options [nop,nop,TS val 1368190512 ecr 3275474774], length 0
22:00:06.234862 IP 172.18.0.5.48072 > 172.18.0.2.5000: Flags [F.], seq 1, ack 27, win 502, options [nop,nop,TS val 3275474774 ecr 1368190512], length 0
22:00:06.234883 IP 172.18.0.2.5000 > 172.18.0.5.48072: Flags [.], ack 2, win 510, options [nop,nop,TS val 1368190512 ecr 3275474774], length 0
22:00:12.242172 IP 172.18.0.5.48080 > 172.18.0.2.5000: Flags [S], seq 801430293, win 64240, options [mss 1460,sackOK,TS val 3275480781 ecr 0,nop,wscale 7], length 0
22:00:12.242210 IP 172.18.0.2.5000 > 172.18.0.5.48080: Flags [S.], seq 3085402626, ack 801430294, win 65160, options [mss 1460,sackOK,TS val 1368196519 ecr 3275480781,nop,wscale 7], length 0
22:00:12.242255 IP 172.18.0.5.48080 > 172.18.0.2.5000: Flags [.], ack 1, win 502, options [nop,nop,TS val 3275480781 ecr 1368196519], length 0
22:00:12.242679 IP 172.18.0.2.5000 > 172.18.0.5.48080: Flags [P.], seq 1:26, ack 1, win 510, options [nop,nop,TS val 1368196520 ecr 3275480781], length 25
22:00:12.242773 IP 172.18.0.5.48080 > 172.18.0.2.5000: Flags [.], ack 26, win 502, options [nop,nop,TS val 3275480782 ecr 1368196520], length 0
22:00:12.242813 IP 172.18.0.2.5000 > 172.18.0.5.48080: Flags [F.], seq 26, ack 1, win 510, options [nop,nop,TS val 1368196520 ecr 3275480782], length 0
22:00:12.242947 IP 172.18.0.5.48080 > 172.18.0.2.5000: Flags [F.], seq 1, ack 27, win 502, options [nop,nop,TS val 3275480782 ecr 1368196520], length 0
22:00:12.242961 IP 172.18.0.2.5000 > 172.18.0.5.48080: Flags [.], ack 2, win 510, options [nop,nop,TS val 1368196520 ecr 3275480782], length 0
22:00:18.060608 IP 172.18.0.5.50594 > 172.18.0.2.5000: Flags [S], seq 607131498, win 64240, options [mss 1460,sackOK,TS val 3275486803 ecr 0,nop,wscale 7], length 0
22:00:18.060662 IP 172.18.0.2.5000 > 172.18.0.5.50594: Flags [S.], seq 289543413, ack 607131499, win 65160, options [mss 1460,sackOK,TS val 1368202542 ecr 3275486803,nop,wscale 7], length 0
22:00:18.060721 IP 172.18.0.5.50594 > 172.18.0.2.5000: Flags [.], ack 1, win 502, options [nop,nop,TS val 3275486804 ecr 1368202542], length 0
22:00:18.061419 IP 172.18.0.2.5000 > 172.18.0.5.50594: Flags [P.], seq 1:26, ack 1, win 510, options [nop,nop,TS val 1368202542 ecr 3275486804], length 25
22:00:18.061560 IP 172.18.0.5.50594 > 172.18.0.2.5000: Flags [.], ack 26, win 502, options [nop,nop,TS val 3275486804 ecr 1368202542], length 0
22:00:18.061612 IP 172.18.0.2.5000 > 172.18.0.5.50594: Flags [F.], seq 26, ack 1, win 510, options [nop,nop,TS val 1368202543 ecr 3275486804], length 0
22:00:18.061982 IP 172.18.0.5.50594 > 172.18.0.2.5000: Flags [F.], seq 1, ack 27, win 502, options [nop,nop,TS val 3275486805 ecr 1368202543], length 0
22:00:18.062010 IP 172.18.0.2.5000 > 172.18.0.5.50594: Flags [.], ack 2, win 510, options [nop,nop,TS val 1368202543 ecr 3275486805], length 0
^C
40 packets captured
40 packets received by filter
0 packets dropped by kernel